{
  "schema": "user-traffic/v1",
  "node_id": "11111111-1111-4111-8111-111111111111",
  "instance_id": "22222222-2222-4222-8222-222222222222",
  "observed_at": "2026-08-27T09:00:00Z",
  "sampled_at": null,
  "heartbeat_age_seconds": null,
  "pruned_max_export_seq": 0,
  "state": "UNKNOWN",
  "truncated": false,
  "users": []
}
