{
  "schema": "user-traffic/v1",
  "node_id": "11111111-1111-4111-8111-111111111111",
  "instance_id": "22222222-2222-4222-8222-222222222222",
  "observed_at": "2026-08-27T09:00:00Z",
  "sampled_at": "2026-08-27T09:00:00Z",
  "heartbeat_age_seconds": 1,
  "pruned_max_export_seq": 0,
  "state": "OK",
  "truncated": false,
  "users": [
    {
      "user_key": "a9703d75e61670054471bf04ee63439c365fcb5f0c54dcb9d8d44ffb30cc56a1",
      "tag": "alice",
      "retained_bytes": 0,
      "connections": 2
    }
  ]
}
